id,comment,rating,placeId,touristId
1,"It's more than just a museum — it’s a captivating blend of art, history, and architecture that leaves a lasting impression.  Housed within the beautifully restored former Supreme Court and City Hall buildings, the Gallery itself is a masterpiece.  Interactive installations and multimedia elements add layers of engagement, making it a dynamic experience for all ages.  A space where art is not only seen but felt, and where every corner speaks to the creative soul of the region.",5,1,1
2,"We visited a few of the exhibitions and there was so much to see and do — you could easily spend half a day or more here. The variety of art on display is really impressive, from early Singaporean works to bold contemporary pieces from all over Southeast Asia.  The building itself is stunning — a blend of the old Supreme Court and City Hall buildings, beautifully restored and full of character. There are loads of hidden architectural gems inside, from grand old courtrooms to peaceful rooftop spaces with great views over the Padang.  Everything is really well presented and thoughtfully laid out, with lots of interactive elements and information if you want to learn more. Staff were helpful and the galleries were calm and easy to explore.  There are also cafés, restaurants, and great photo spots throughout the space. Whether you’re into art or just want to take in some culture and history, this place is absolutely worth popping into!",5,1,2
3,"The entry hall to the gallery is spacious and impressive. Staff were both professional and friendly. Our entry fee was kindly reduced due to our concession and educator qualifications from a different country - we found that very kind and inclusive. We only had a short time to visit so mainly concentrated on the contemporary art on Level 4. We loved the diversity of art forms in that section and the powerful commentaries conveyed by the artists through their art. The gallery shop, cafe area and child- focused sections are also excellent.",5,1,3
4,Very huge museum with lots of exhibitions to offer. We bought the all access pass for $24 per person but didn’t have the energy to explore them all. It’s very crowded during weekends though.,5,1,4
5,"I was very surprised because the space was so large. I really like art so when I came here I was immersed in art, I was here for 3 hours without getting bored. It is worth the money to buy tickets, very suggested for everyone !!!",5,1,5
6,"What a lovely afternoon exploring Arab Street! The whole area is full of charm with colorful little shops and friendly vendors. I wandered around with no real plan and ended up with a delicious snack in hand and a beautiful blue pendant with green emerald details from a Turkish shop. It was such a nice surprise.  The highlight was visiting Sultan Mosque. It is absolutely gorgeous in person. The golden dome catches your eye from far away and the entire place has a peaceful and welcoming atmosphere. If you’re in Singapore, make sure to stop by. It is a perfect mix of culture, color, and calm.",5,2,3
7,"A must-visit if you’re in the Kampong Glam area! The Sultan Mosque is one of Singapore’s most iconic landmarks – its golden domes and detailed architecture are absolutely stunning. Set in the heart of the Malay Heritage District, it’s a peaceful place to pause, reflect, and take in the history and culture of the area.  Even if you’re just walking by, the atmosphere around the mosque is vibrant, with colourful shophouses, street art, and local eateries all within a short stroll. A fascinating and photogenic stop that gives you a real sense of old Singapore.",5,2,4
8,"A large, clean, and spacious mosque with an upper floor for women and a ground floor for men. For women, there are ablution facilities and restrooms located outside, and prayer abayas are available for use. Masha’Allah, the mosque is big and has a large number of worshippers — may Allah increase and bless them. Thanks to those managing the mosque ❤️👌🏻",5,2,5
9,"You can entry for free, and it's a really comfy place to pray. Men and women have different entrances. The women’s wudhu area is right near the shoe racks, and there are toilets inside too. You can take the stairs or elevator to get to the women’s prayer area on the second floor. Mukena is available if you need one. There are big fans and some power outlets around too",5,2,6
10,"Last month, I had the chance to visit the iconic Sultan Mosque in Singapore. The architecture is absolutely stunning, the golden domes, detailed design, and peaceful atmosphere make it a must-visit. I was especially moved by the history behind the mosque, especially how the base of the dome is made with glass bottles donated by the local Muslim community. A beautiful place rich in culture, spirituality, and unity.  Highly recommended for anyone visiting Kampong Glam!",5,2,1
11,"Sri Mariamman Temple, located in the heart of Singapore’s Chinatown, is the city’s oldest and most significant Hindu temple, established in 1827. Dedicated to the goddess Mariamman, revered for her healing powers, the temple showcases intricate Dravidian architecture, with a vibrant gopuram (entrance tower) adorned with multicolored sculptures of deities and mythological figures.  Visitors often highlight the temple’s serene atmosphere and spiritual ambiance. While some note that the temple is relatively small and can be explored in about 10–15 minutes, its rich cultural significance and ornate details make it a worthwhile stop, especially when exploring Chinatown.  The temple is open to tourists, who are required to remove their shoes before entering. Photography is permitted for a small fee.",4,3,2
12,"Important: you are not allowed to enter wearing shoes, so my advice is to bring some socks with you in the purse so you won’t have to walk there barefoot - because honestly is not the cleanest floor you could walk on. My socks were trashed after visiting it. The temple is very beautiful and colorful. If you have very short pants/skirt there is a nice person there who guides you to some skirts that you can tie over your own. The paintings are very vivid, and the multitude of deities is impressive. Outside they have some presentation for some of them. Overall was a nice experience and the people there are very friendly.",4,3,3
13,"Location is in the Chinatown area and is very easy to spot even from a farther distance. It’s free to enter but there are basic requirements to enter such as leaving your shoes outside which they have added a shoe rack spot to the right of the entrance, dress in a respectful manner, and no video recording in some areas of the temple.  The temple’s inside and outside are gorgeous with colorful paintings on the inside walls, color scheme just pops on both the inside and outside and the temple just stands out from it’s neighboring buildings. Definitely recommend to visit when you’re in the area and have some free time.",5,3,4
14,"Walking into Sri Mariamman Temple felt like stepping into a living painting. The vibrant colors, intricate carvings, and peaceful energy made the whole space feel sacred and alive. The details on the temple’s facade are stunning, and once inside, everything feels serene and full of meaning.  Just a little heads-up, you’ll need to take your shoes off before entering the temple grounds, so wear something easy to slip off. I didn’t have to wait at all to get in, and the experience left me with a calm heart and a deep sense of wonder. If you’re curious about spirituality, love colorful architecture, or just want a quiet moment in the middle of the city, this place is a ge",5,3,5
15,"This small temple was right across from the hotel where I stayed. On my first day, I happened to pass by while a religious ceremony was taking place, and it was open for the public to join. It was a really beautiful sight.  The temple’s bright and colorful gopuram (entrance tower) is a real showstopper, covered in intricate carvings of Hindu deities and mythical figures. It’s such a striking sight that it immediately draws your attention. Definitely worth stopping by for a closer look!",5,3,6
16,"The Armenian Church of St Gregory the Illuminator, is an amazing place to enjoy peaceful moments with yourself, praying and praising our Almighty God. Beautifully built church with nice and meaningful sculptures, one of which is Jesus Christ with cross. I love everything about that place. God bless you all 🙌🏻",5,4,1
17,"A very beautiful and well maintained church, albeit small, especially when compared to other churches within the vicinity. As the oldest church in Singapore, it appears to be simple, humble yet rich in history.  Too bad we didn't get the chance to visit inside the church as it was closed to the public for a private event.",4,4,2
18,I highly recommend a visit to Singapore's first church built in the early 1800's. Armenians have played an integral role in the development of Singapore from the Raffles Hotel to Armenian Street.  A visit (by appointment) to the museum on the church grounds is also worth it to further understand the rich history of Armenians in Singapore.,5,4,3
19,The oldest church in Singapore. Friendly to visitors as the gate are always open during the day.,5,4,4
20,"A little piece of history, piety and culture in the middle of the city. When I visited this place, there wasn't much people, so it was very serene and quiet all around the church and garden. I just hope they would maximize this place, not just as a historical site, but also as a church and cultural center. I wonder if, aside from weddings, Eastern Rite liturgies are still celebrated here?",5,4,5
21,"The historical CHIJMES building, located in the heart of Singapore’s vibrant Orchard Road area, offers one of the most beautiful settings surrounded by lush greenery. It houses a stunning former church alongside a variety of food and beverage outlets. A wonderful destination for both tourists, visitors and locals to explore and unwind.",4,5,4
22,This place features beautiful architecture and also offers a variety of restaurants. It’s perfect for enjoying a meal with family and strolling around to admire the stunning buildings. It’s also easy to get to — I traveled there by bus.,5,5,5
23,"CHIJMES is such a beautiful and peaceful place with stunning architecture. I truly appreciated the respectful atmosphere and the sense of history there. The area is very clean, the people around were kind, and I felt so happy to discover such a charming and meaningful spot. Best to visit in the morning or early afternoon, as it can get quite hot later in the day. A lovely place for quiet reflection and tasteful photos.",5,5,6
24,"Old building but super aesthetic, lots of photo spots, and great selection of restaurants/bars. Perfect for chilling or a relaxed evening walk. The vibe is really different from other places in Singapore!",5,5,1
25,"Walking into CHIJMES felt like accidentally stepping into a peaceful, storybook world, except this one comes with wine bars and really good lighting.  By day, it’s like the city took a deep breath and made a little space just to chill. The old chapel is stunning, and if you look closely at the top of the columns, you’ll find tropical flowers and birds carved in, like someone said, “Let’s make this place gorgeous, but make it extra.” And they did.  One of the most touching spots? A little gate called the Gate of Hope on Victoria Street. This was where babies were once left to be cared for by nuns. Yeah, I know, suddenly you’re not just sipping an iced latte in a pretty place, you’re standing in living history. Wild, right?  But then… the sun sets. And bam, CHIJMES transforms into this lively, sparkling maze of restaurants and bars. One second you’re in quiet reflection mode, next you’re Googling “How many tapas is too many tapas?” while live music spills out from somewhere nearby. There’s food from everywhere, Spain, India, maybe even your future favorite.  It’s elegant without being stiff, historical without being dusty, and social without being overwhelming. I came here for the architecture and stayed for the sangria. Ten out of ten, would accidentally become a regular here.",5,5,2
26,"Well worth popping in if you’re passing by! This charming spot is a hidden gem with real character. Whether you’re just exploring the area or on your way to somewhere else, it’s definitely worth a short stop. The staff are friendly, the atmosphere is welcoming, and there’s a strong sense of history here.  Originally established in the early 20th century (or insert specific date if known), this place has stood the test of time—retaining many of its original architectural features and charm. Over the years, it’s become a favourite with both locals and curious travellers. It’s not just a quick visit, but a place that tells a story.  Look out for small historical details, vintage decor, or old photos on the wall that hint at its past. Whether you’re into history, architecture, or just enjoy discovering something different, this place is well worth your time.",5,6,1
27,"Located at the heart of Singapore Civic district, this oldest Anglican Cathedral is a historical charm. Its stunning Neo-Gothic architectural style, featuring tall white columns and beautifully arched ceilings that create a sense of serenity.  The white exterior made it really stands out among the modern concrete. Its interior, however, looks rather simple in comparison and the church is smaller than I thought. That said, it is worthwhile stop for prayer, reflection, or simply to admire its beauty.",3,6,2
28,"Very beautiful church, open to the public. We arrived when the people were preparing to have service so we left pretty fast. The stained glass windows are wonderful.",5,6,3
29,"A peaceful and awe-inspiring place to visit in the heart of the city. The cathedral’s architecture is stunning, with tall white columns and beautifully arched ceilings that create a sense of serenity. I was able to walk in without any wait, and the staff were kind and welcoming.  Whether you’re here to pray, reflect, or simply admire the beauty of the space, it’s absolutely worth stopping by. Quiet, calming, and full of historical charm.",5,6,4
30,"Singapore's Anglican church Cathedral  - large, inpressive, and, which is most important to me personally, extremely welcoming to the visitors like me: starting from their beautiful, spacious and relaxing visitors centre on to very informative route planners and narrative posters all around its premises. Well done, God bless you, kind people of St. Andrew's!",5,6,5
31,"No visit to Chinatown is complete without lingering near the Buddha Tooth Relic Temple — not just for its gilded serenity, but for the lively checkerboard dramas unfolding on its periphery. Clusters of seniors huddle over games of ""big checkers"", their wooden pieces slamming down with the gravitas of chess grandmasters.  Tourists pause to watch, charmed by the spectacle, but it’s clear this is no performance. The players’ intensity — eyes narrowed, fingers tapping the grid between moves — hints at ""decades"" of rivalry, and perhaps a few discreet wagers. The temple’s incense-heavy air mingles with their laughter and groans, a reminder that even in sacred spaces, humanity thrives on small, stubborn joys*.",5,7,4
32,It is a stage outside the Tooth Relic Temple and Chinatown Complex Market and Food Centre. Not big.  Sometimes there are live performances there. Best to hear the songs sung by the artistes from level 2 food centre while having a meal with some breeze from the wall fans.  On a daily basis some elderly would gather to play chess or simply chitchatting.  It is also commonly known as the meeting place before a walking tour starts.,4,7,5
33,"12 life-sized tiger displays currently at Kreta Ayer Square (Open space between Buddha Relic Temple and Chinatown Complex) - Exhibition is ongoing from now till 15 February 2022.  This is an initative to raise the awareness of  tiger conservation as we welcome the Year of Tiger. Painted by local artists, injecting different personalities to these tigers.  Can be crowded as many were taking photos. Nice place to go after dining at Chinatown Complex",4,7,6
34,"Its located opposite the Tooth Relic Temple, near the Chinatown Street Market and one of the entrance of China Town Complex. Its a square with a stage for performance during special occasions like lunar new year. This is also the gathering place for old folks to chit chat or to play a game of chess.",4,7,1
35,This Square is nearly not as interesting as they say. The surrounding area is far nicer to take a walk and explore.,3,7,2
36,This is a nice Street and area with lot of decorations and wall arts. It is filled with tourists and crowded. Lot of restaurants and street food vendors everywhere. You can walk around and explore here. Recommended!,5,9,2
37,"It's worth a visit to try out some local food or buy some souvenirs. Walk down the street and also around the corner, as there are other shops/stalls, including a Starbucks in a beautiful colourful building. There are food stalls, restaurants and other Shops that sell souvenirs. It's located next to the Chinatown Complex",4,9,3
38,Very interesting place to visit where you'll find lots of shops and restaurants with different Chinese cuisines!,5,9,4
39,"The retro-style snack street, and the old brother who does henna tattoos there has great skills.",5,9,5
40,"Food is good and have a great service. Very kid friendly staff. Wish i didnt have  stomache bug the night before this day, coz id love to devour that crab",5,9,6
41,"TC, the trishaw rider, was an excellent guide! He shared many interesting facts and secrets around the house. The place is filled with all sorts of items from the past! Very interesting learning about everything. Downstairs there is a shop full of Singapore souvenirs and a special tea shop. Highly recommend to come here. Full air conditioned too!",5,10,6
42,What a great place to learn about developing Chinatown within Singapore. This place was super informative and interactive. I learned so much here going through the different exhibits and rich history that was provided. Definitely a must visit when touring through Singapore.,5,10,1
43,"Highly recommended to plan a visit here for those who wants to learn about the life in Chinatown pre-independence. Highly experiential learning opportunity here.  Great amount of care to recreate the days past and highly interactive displays to bring to life the daily living of the past generation.  Hopefully, it will show how much we have to be grateful for the life we have nowadays.",5,10,2
44,"Today was the perfect opportunity to visit the Chinatown Heritage Centre, especially since we missed the soft launch. We had no regrets booking our tickets online and making the visit. Although our reservation was for 3 PM, we arrived earlier, and the attendants kindly allowed us entry.  It was a quiet afternoon with fewer visitors, giving us the chance to explore at our own pace, read the exhibits, and take photos without obstruction. Our first impression was that the place is well-maintained and clean. It was truly an eye-opening experience to learn about Singapore’s history and the struggles of early immigrants who arrived in Nanyang, hoping to find prosperity.  This heritage centre is an insightful visit, especially for younger generations, as it provides valuable knowledge about our ancestors who settled here. The centre also offers videos that showcase historical events and experiences. However, visitors should be mindful when walking down the narrow and dimly lit staircase—we chose not to take the lift.  Overall, it’s a highly recommended visit for anyone interested in Singapore’s rich heritage.",5,10,3
45,"Pretty fun, well-thought and curated museum that gives you a glimpse of the genesis of Chinatown in Singapore, through the lense of migrant workers, how they lived and earned a living, and how it all set a foundation for the modern yet traditional lifestyle we all know today. Well kept and comfortably air-conditioned. Worth a visit for sure, but I felt the tickets were a bit on the pricey side.",4,10,4
46,"A beautiful and peaceful slice of history in the heart of modern Singapore. Thian Hock Keng Temple is one of the oldest and most important Hokkien temples in the city, originally built in the 1830s by early Chinese immigrants giving thanks for safe passage across the sea. It’s dedicated to Mazu, the Goddess of the Sea — very fitting considering Telok Ayer Street used to border the old shoreline before land reclamation.  The architecture is stunning, with intricate carvings, colourful tiles, and dragons coiling up the rooftop. No nails were used in the original construction — a real testament to traditional Chinese craftsmanship. You can really feel the cultural and spiritual significance as you walk through the temple courtyard.  It’s a peaceful retreat from the city buzz, and a must-see if you’re exploring Chinatown or interested in Singapore’s multicultural heritage. A hidden gem for those who love history, art, and architecture.",5,11,1
47,I visited the Thian Hock Keng temple and it was a very peaceful visit. This is the oldest temple in Singapore and has Chinese heritage in terms of the impressive architecture. The temple is open during day time and you don't need a ticket to enter. There are incence and candles available for free but a donation is recommended. It has some areas where photography is prohibited but the main temple grounds is not. Highly recommended!,5,11,2
48,"Thian Hock Keng Temple is an example of traditional Chinese architecture and one of Singapore’s oldest temples.  Admission is free, and the temple is well-maintained with informative plaques for visitors.  Be mindful in hot weather - the smell from traditional burnings can be quite intense, better to bring some water. Also there are parts where photos and videos are not allowed to provide privacy to those who pray.",5,11,3
49,"Thian Hock Keng is one of the earliest Chinese temples in Singapore. Located in the bustling city center, it is popular with both tourists and locals. The temple features beautiful historical Chinese architecture and is well maintained.",5,11,4
50,"Located in the business district of Singapore, Thian Hock Keng Temple is a stunning example of traditional Chinese architecture and one of Singapore’s oldest temples. The temple is dedicated to the revered sea goddess Mazu (妈祖 or 南海娘娘) and other deities for worshipping. The intricate carvings, vibrant colors, and detailed craftsmanship are truly impressive. Worth the visit to experience and immerse in the different Chinese heritages.",5,11,5
51,Such an amazing place to discover Eurasian roots and the olden days Singapore. It’s like a mini museum but it has quite a myriad of artefacts. It is well worth a visit!,5,12,6
52,"I would have given 4.5 stars for the exhibition but we had the strangest experience upon entering which in fact deserves one star. The female at the counter assumed I was a foreigner (foreigners pay a small sum to enter). I told her I was PR and my daughter a citizen. Instead of politely asking for my ID she very roughly demanded “show me” twice. I wanted a nice experience for my 8yo daughter so I complied without fuss. She then turned to my young girl and said she must pay. I was confused. I repeated that my daughter was a local Singaporean but she refused to believe me. It’s only when my Singaporean husband entered that she backed down. Nice introduction to the Eurasian community!  Unfortunately they no longer have an activity book/pack for children so I hope if they read this they’ll reintroduce one as the children would gain far more from the actual exhibition.  As for the exhibit itself, it’s quite good though a little crammed with information but I understand space is a constraint.  Would recommend if you’re combining a trip with the gorgeous downstairs Eurasian restaurant “Quentins” which my family and I love. Otherwise, given the odd reception by that woman, I’d give the exhibit a miss.",3,12,1
53,Just joined the Eurasian Association and was there for a welcoming ceremony. Our race is often forgotten being a minority race in Singapore. Come on down to EA and know more about us. The gallery is on the 4th floor,5,12,2
54,First time here. A quiet place with comprehensive information you need to know about Eurasian community. Lot of interesting fun facts. There is a restaurant on the ground floor serving Eurasian food but I didn’t have time to try it. Maybe next time.,5,12,3
55,"Absolutely loved the gallery! Quite small and located on the floors above, there is a lot of history packed into such a small place. I was fascinated by all the memorabilia and stories about the western influence on Singapore. I was even amazed to find my own surname which is quite localised to where I am from displayed amongst the collection with a coat of arms and the reference used which influenced the naming of a street. I spent about 30 mins although could have easily spent an hour going through all of the gallery.",5,12,4
56,It’s okay.  The atrium space has a few popular restaurants and it can get quite busy at night.,4,13,5
57,If u were born in the 60/70s there is a chance u have been here before and it was a movies and Makan chill date place,5,13,6
58,Beautifully decorated. Posh and chic.,4,13,1
59,A nice & chill place for a lunch gathering with old friends. Would love to visit again. 💕💞❤️  The carrot cake in the cafe really looks cute. It tastes good as well 😍,5,13,2
