id,comment,rating,placeId,touristId
328,"An amazing peek into a colourful and rich culture born when the Chinese came down to Malacca, Penang and married the locals thus the first Peranakans or straits born Chinese. The narrative was detailed and full of little anecdotes of those times. Thank you. It was enjoyable",5,69,4
329,"Great place to learn about Peranakan culture and history. The place is only open upon appointment if I'm not wrong. Went there recently to learn beading. Really enjoyed learning more about Peranakan history and culture. Museum is full of pretty and meaningful antiques, great for photos!",5,69,5
330,Lovely Sunday morning spent here learning about the Peranakan culture. Highly recommended to visit and learn more about  the heritage! (By appointment only),5,69,6
331,I highly recommend this place to enjoy the sunrise quietly in Singapore. It’s such a nice way of starting your day and you can spend hours exploring this garden. There’s some early birds doing their morning walks but everything is so silent it is perfect,5,70,3
332,"Wow, where do I start? When you walk into the park it’s kinda meh experience. Sure, the bridge is nice and there is good few nice trees and such, that huge pagoda in the background looks promising, but it’s kinda empty. Not like the Sydney one, jam packed with things. But then you start walking around and you see the genius of it. It’s not all squeezed in into one tiny space. Oh no! It’s perfectly designed to keep you excited all the time. And the beauty of this place! Not only that, this place is a literal sanctuary for so many animals, right in the middle of busy (and you need to go to Singapore or Hong Kong to understand what busy means) housing area. Without any effort whatsoever I’ve seen two huge monitors, 2-3 lizards, super friendly squirrels and tons of birds. Just like that. Loved the tiny pagodas, loved the zodiac, the maps are of great help. Spent there over two and a half hours and only left to see the second one. The Japanese garden.",5,70,4
333,"There is ongoing construction work near Chinese Garden MRT station but there is prospect to be a good attraction for tourists. Currently, it's still good if only for jogging places. There's enough toilets, free drinking water refills and everyone can enter without any admission.",4,70,5
334,"Visited this park again after 8–9 years, and I’m glad to see how much it has changed! They’ve revamped quite a bit, added more eateries, and maintained it really well. Still as pretty as ever—love how they’ve kept the charm while improving the space!",5,70,6
335,"A very beautiful park with both Chinese and Japanese gardens, and more. You can take a walk, cycle, or run while enjoying the scenic views, or simply relax and have a picnic. There are plenty of rest areas, restrooms, and restaurants available. Unfortunately, the lake water was dirty when I visited, but the overall atmosphere is still peaceful and enjoyable.",5,70,1
336,"Nice serene place for a Good walk during weekend. This beach offers Lots of human activities engagement which includes: Swimming, BBQ, Gathering of families and friends for a simple picnic as well as couples wishing to spend some time winding down. The beach welcomes anyone with open arms. Lots of cyclist as well as skaters were seen at the beach too. Toilets and wash points are conveniently set up across the park. Just be mindful that some car parks are chargeable while some are free parking. Lots of varieties of food to choose at East Coast lagoon food centre as well. Other options includes fast food like McDonald",5,71,3
337,"Best beach you can find in Singapore, plenty of parking lots, restaurant and cafe, pet friendly too. The park was beautiful and there were many tables and bench for resting. You can rent bicycles here to cycle along the coaster. The road was built wide enough for an enjoyable ride, you will feel safe as they are separated from the walking pavement. Along the way you can find restaurant,  cafe, children playground and toilets for your needs. There are areas for camping and bbq, and it is definitely a good place for family gatherings.",5,71,4
338,"The beach park itself was beautiful. But what I loved even more was riding a bike along the wide, well-maintained paths. It felt calm and free.  Singapore is such a bike-friendly city. Bike lanes are clearly marked, traffic is light, and drivers are incredibly respectful. You really feel safe on the road, which makes the whole experience even more enjoyable.  The sunlight, the shadows, and the green from the trees blended together so perfectly. fresh, peaceful, and just quietly beautiful.",5,71,5
339,"I frequently visit East Coast park as it is on one of my exercise walking routes. The hawker center has something for every taste, the walk paths and surrounding areas are well maintained and groomed. There is an automated water ski lake with three levels of difficulty for every skilled level. Very beautiful and serene place to spend time.",5,71,6
340,"Amazing as always. Recommend coming here for cycling with friends or families. As a dog lover, love that people bring their cutest dogs and pets here for walks. You will also see some awesome people doing wakeboarding and you can try it in a safe mini-version at a small lake too (paid, booking likely needed).  All in all great wind, sunset, people, dogs and vibes. Also great seafood if you’re into that.",5,71,1
341,"Beautiful place with lots of different mini parks and photo locations. Can enjoy the nature and view the city while exploring the history of Singapore. One of the hills in Singapore with great views. Better to visit in the early morning or in the afternoon. Anyway this is one of the must visit beautiful place in Singapore as its full with nature, history and great landscape.",5,72,4
342,"Fort Canning's Tree Tunnel: Worth the Wait! 🌳✨ Just brought my clients to the famous Tree Tunnel at Fort Canning Park, and wow – what an experience!  - 1-Hour Wait? Totally Worth It! ⏱️ We spent about an hour getting our shot, and every minute was invested in pure magic. The way the light filters through those leaves and frames the staircase is just surreal.  - Clients LOVED It! 😍 They were absolutely mesmerized by its unique beauty. It's not just a photo op, it's a true Singapore gem.  - Picture Perfect! 📸 Seriously, you'll walk away with some incredible memories and stunning photos.  Have you discovered this hidden (or not-so-hidden!) gem in Fort Canning yet? Share your experience! 👇",4,72,5
343,"Great park for a quick stroll. Decently-sized and strategic location, can definitely pump in a few kilometers by going around a couple laps. Loops around twice, like a 2 tier cake!",5,72,6
344,"Fort Canning Park is a lush green oasis and historic botanical garden nestled right in the heart of the city. It offers a peaceful retreat with mature trees, beautifully landscaped gardens, and a variety of scenic photo spots. The park is rich in history, featuring relics and monuments that tell the story of Singapore’s past.  Visitors of all ages can enjoy exploring its highlights, including the Spice Garden, heritage trails, and the Heritage Gallery that showcases the park’s significance. Explore war bunkers, tunnels, excavation sites.etc Perched on a hill, the park provides panoramic views of the city skyline — a perfect backdrop for a leisurely stroll or photo session. A luxury hotel nearby also makes it a convenient spot for tourists.  Whether you're a nature lover, history enthusiast, or just looking for a tranquil escape, Fort Canning Park is a must-visit destination in Singapore",5,72,1
345,"Fort Canning Park was one of the photo locations I really wanted to visit during my trip to Singapore and it did not disappoint! The spot is famous for its iconic spiral staircase, and it’s absolutely worth the visit if you're into photography or simply want a unique picture memory.  For solo travelers, You can easily set up your tripod without any issues. I also happened to meet a friendly part-time photographer inside the park who offered to take my photos. He charged just $5 for 15  pictures, and honestly, it was totally worth it.  A tip: go early in the morning to avoid the long queue that forms near the popular staircase. Entrance to the park is free, which makes the experience even better. Beautiful, peaceful, and photo perfect highly recommended for solo and group travelers alike!",5,72,2
346,"Lovely location to relax, enjoy the beaches (including Lazarus Island) and look at the Chinese Temple and tortoise sanctuary. Would have been good to have had a sign with information about the sanctuary, e.g. were these rescued tortoises? Great service from Island Cruise Ferries.",4,73,3
347,"A peaceful getaway from the mainland starting with a comfortable ride in air-conditioned ferry on a guided community tour. The island was serene, charming and quiet. Met the caretaker of the island who explained the history, and challenges of maintaining the island. Enjoyable experience, and worth coming here",5,73,4
348,"A welcome dose of peace and quiet, Away from the city grind, a chance to hear my own thoughts again in kusu. The 152 steps climb wasn’t easy, but the view was a good payoff. Kusu is A chance to reflect without pressure and The temple, the shrines, the turtles offer a life stripped back to essentials.",5,73,5
349,"This is a nice little island to visit for picnic, swimming and snorkeling (other than just visiting the temple) There are two lagoons and one of them offers clear view of marina bay. Many pavilions with picnic tables next to the beach. There’s also a functional toilet and outdoor shower for swimmers :) (though a bit rundown and unpleasant due to old age) To our surprise, we also found the beach with thriving with lots of lives. At about 4pm, the tide is low enough and you can just walk in the lagoon. This is when we found a lot of hermit crabs, crabs, fish and even some corals :))) Very fun visit in short. I’ll definitely return for another picnic or swimming",5,73,6
350,"Packed with foreigners during PH which ruined the nice vibes of the island. Otherwise, it’s pretty overrated in my opinion as the place is like an offshore East Coast Park. The turtle pond looks sad and not well maintained. Nothing much to do here. Save the day by going to other islands instead.",3,73,1
351,"This bird park is a fantastic example of inclusivity and thoughtful design. The entire park is equipped with elevators and gentle slopes, making it easily accessible for people with disabilities and seniors. After every 10-20 minutes of exploring the vibrant aviaries, visitors can rest and rejuvenate in air-conditioned rooms furnished with comfortable chairs—each space providing fascinating information about the unique bird species featured in the park.  The birds all appear exceptionally healthy and well cared for, with an abundance of food—sometimes attracting the attention of some opportunistic rats as well!  One highlight of our visit was the complimentary ""Wings of the World"" show. The parrots were remarkable; one even sang a delightful ""Happy Birthday"" song! The staff truly go the extra mile to ensure everyone is included. They bring the birds around the amphitheatre during the show so guests in every section.  Overall, this bird park delivers an enjoyable, educational, and accessible experience for visitors of all ages and abilities. Highly recommended!",5,74,6
352,"Well designed birds park that is rightly named as a Paradise for birds. It was an innovative design where the birds were set free inside a huge controlled environment. Each segment had like birds together so they will not be disturbed. It’s nice to see birds flying around and sitting on one’s head or shoulders. The segments are connected by AV based information rooms, which are air conditioned and had resting set up. The flamingo land with the waterfall was very astonishing. Don’t miss on the shows where the birds can be seen performing. Strollers are available for rent for the infants. Mother feeding rooms and baby care rooms were very neatly maintained.",5,74,1
353,"Bird Paradise Singapore was such a lovely experience – truly one of the highlights of our trip. The park is beautifully done, full of lush greenery and open spaces, and you’re surrounded by birds from all over the world. It felt peaceful, fun, and really refreshing to spend a day here.  The penguins were an absolute delight! Watching them swim around and play was just too cute – we could’ve stood there for hours. And don’t miss the “Wings of the World” show – it was honestly impressive. The birds flew right above us and the trainers did a great job explaining each one. It was exciting, fun, and informative all at once.  The park layout is easy to follow, and there are lots of shaded areas to take a break. There are also water refill stations throughout, which is great if you’re carrying your own bottles.  That said, the weather was super humid during our visit. We were sweating quite a bit, so I’d definitely suggest bringing a small portable fan and wearing breathable clothes. Also, while the refill stations were handy, the water wasn’t chilled – and trust me, on a hot day, you’ll wish it was!  Still, those are minor things. The overall experience was just beautiful. The birds are well taken care of, the staff was helpful and friendly, and you can tell a lot of love and thought went into creating this place. If you’re visiting Singapore, Bird Paradise should definitely be on your list.",4,74,2
354,"I’ve been to Bird Paradise twice, and the penguin exhibit remains my favourite. It’s such a joy to watch them up close in a cool, comfortable setting. While most of the park is outdoors, it’s great that each zone includes an air-conditioned indoor section for a break from the heat. I watched both shows and personally enjoyed Wings of Asia more. The performances were impressive and well-paced. Overall, a fun and well-thought-out experience for all ages.",5,74,3
355,"Bird Paradise was excellent.  Birds are out even in the heat of the day.  The park was planned with air-conditioned areas to give you a break from the heat just when you are starting to get really hot.  I especially recommend the Backstage Pass Penguin Encounter. The price may seem high, but it is definitely worth it.  We had at least 10 penguins frolicking around us. It was definitely something I'll never forget.  Just beware of the Penguin poop.",5,74,4
356,Visited HortPark on a Sunday evening—peaceful and relaxing with a lovely sunset. Great spot for a walk and to unwind after a long week.,5,75,2
357,"As part of the Southern Ridges, HortPark is a beautifully maintained gardening hub, perfect for nature lovers, walkers, and anyone seeking a peaceful escape. As part of the Southern Ridges. It features well-landscaped gardens and a tranquil atmosphere that many visitors appreciate.  One of the highlights for me is the Silver Garden, where striking white and silver plants create a uniquely serene and picturesque setting. Love taking peaceful walks from Kent Ridge Park to HortPark and back—a refreshing route that’s perfect for light exercise. The well-paved trails, lush greenery, and quiet surroundings make it an ideal place to unwind, especially in the morning or evening.  Highly recommended for nature walks, garden enthusiasts, and anyone exploring the Southern Ridges!",4,75,3
358,"Loved the walk I had last evening. Pleasant. 10mins short walk from mapletree business city MBC. Get in touch w nature after a stressful day at work, breathe fresh air and clock some steps b4 day ends.  Park is well maintained, clean, some mosquitoes but not that much that it’s unbearable.  There are a few nurseries too.",5,75,4
359,01/April/2025 Visited HortPark in the late morning. Free admission. There are 2 F&B outlets here. Lots of sitting around the park. Chargeable open-air parking available.,5,75,5
360,"The canopy walk is nice. Start there and continue to do the Southern ridges (check first if the path above the forest in open, it was closed when I went but the walk was still pleasant).",3,75,6
361,"I think this is a great water park, their rides, enough lifeguards and  especially their reef swim experience. But their snorkeling equipment is really not kept up to maintenance, snorkeling mask leaked, snorkeling tube isn't the right mouth guard size.. meant more for kids.  Otherwise, it would be a great experience.  The way they handle end of day park closure would need further improvements, there isnt enough shower facilities and yet the closed the shower facilities that was near the reef swim area, forcing everyone to only use the shower facilities by the park entrance! The queue was for another hour at least, I left without showering, just chsnged to dry clothes and left. they can improve on the way they end the day's operation would be better.",3,76,6
362,"A fantastic waterpark in Sentosa where you can spend the entire day there. There are lots of slides and water activities for everyone, from the young to the old. Some rides do have a height and weight restriction. There are lockers where you can put your items away and they have different sizing options. The popular rides are the different slides, wave pool, river ride (where you’ll experience random waves, splashes and underwater tanks) and snorkelling. There is a place for a feed when you’re famished and they do great satay which are cooked as you order. Lots of photo opportunities and you get to buy them on your way out. The rides will be suspended when there is a lightning warning but will reopen quickly once it’s lifted.",5,76,1
363,"Great place for kids & adults. Highlight: lazy river & wave (unfortunately the waves in lazy river was under maintenance when I visited in May🥲)  Not a lot of activities (as shown + snorkeling + short slides not pictured), only worth to visit during leisure / excess time for tourists  Recommend to bring waterproof phone holders for photos + water shoe to walk around so feet don’t get burned by the scorching heat while exploring by foot!",4,76,2
364,"Adventure Cove Waterpark is a less than 10 minute walk from the Resorts World Sentosa monorail station (one stop from the Harbourfront MRT station at the top of VivoCity. It is a great way to cool off with splash zones, rides, snorkelling, and of course, the lazy river circling the entire area. Bring your own beach towel unless you want to pay $30 at the shop. There are lockers at the front by the change room as well as another set of lockers by the wave pool and restaurant. Lines for the rides get longer by 11 so coming earlier is better. There is also a ray feeding opportunity which is short but fun.",5,76,3
365,"Nice rides, but unfortunately some were under maintenance for us. Wave pool is nice, but a little small. Food is okay at the restaurant. The lazy river is great and has a nice theme to it. Wild Wild Wet is an alternative to this and half the price with more rides and a wave pool.",4,76,4
366,"One of the most relaxing areas you can visit while in Singapore in the evening, have a drink at one of  the many bars on the waterfront.  When all of the skyline is lit up at night, it's magical with the reflections on the water...definitely a place to be on the Promenade.",5,77,1
367,"This river is more clean than I thought. Just visited here for a history learning journey with my class and it was amazing. It was very interesting learning about the history behind this river and it's almost unbelievable that just a few decades ago, this river was unimaginably filthy. Really nice experience here.",5,77,2
368,"Great scenery and variety of breakfast options, good for a morning walk.",5,77,3
369,"my route every morning either morning walk or cycling. Liked it so much , can catching up sunrise",5,77,4
370,"On our 3 days trip to Singapore this time, we never wasted a chance to walk around this river, right from Four points by Sheraton to Durian building in broad day light and colorful nights. The river is amazingly clean & tidy, surrounded by cafes, restaurants, sky scrappers, clark quay, bungee jumping, boat rides etc. Plenty of options to spend your time. Don’t miss it",5,77,5
371,"Every corner tells a story. Walking through the space felt like stepping into a different era. A must-visit for anyone who appreciates history, architecture, or just want a meaningful escape in the city.",5,78,5
372,"There're several colorful houses in a row. It was a pretty cute view. It takes about 10 minutes from Marine Parade station on foot. There are a variety of shops like cafes on the way. So, you won't feel so far away from the station.",4,78,6
373,"Visited the Peranakan Houses on a cloudy day, just before the rain came and it was such a beautiful spot to explore. The vibrant heritage architecture is perfect for anyone who appreciates history, design, or just a good photo opportunity.  After taking some photos, you can enjoy a coffee at one of the nearby local cafés. The walk to the nearest MRT is pleasant, with lots of interesting local shops, a boxing gym, and even a vinyl record store along the way.",4,78,1
374,Beautiful and colorful Paranakan Houses. It can get pretty crowded with lots of tourist trying take photos of these rows of beautiful houses. So come early,5,78,2
375,"Pretty houses. Nothing to visit, just a view from the street. There are alternatives near Orchard Road that may be more convenient.",4,78,3
376,"Sentosa is always fun and never feels boring. The new aquarium is amazing, and I love the cultural touches around the area. It’s clean, beautiful, and worth every dollar. A great place to relax and enjoy in Singapore!",5,79,5
377,"Love sentosa Already spent few full days at the place, but I feel like there are still a lots to discover  This place, you can bring anyone and still can find some activities to enjoy with.  I already spent time at Universal (1d), Water Cove Park, Aquarium, HarryPotter museum All are worth it, but what I hate is I have to queue a lots",5,79,6
378,A nice and quiet beach day for me.  Come here on a weekday sun and beach time.  Very relaxing.  The water was warm and cooling at the same time on a sunny hot humid day.  A very nice walk along the beach.,5,79,1
379,"It’s a beautiful island. There’s a monorail that connects different stations. Universal Studios, Sea aquarium, Madame Tussauds museum are in this island. The sea looks beautiful, you can take a cable car ride and view the entire island. There’s a show called “Wings of time”, it’s a lifetime experience !",5,79,2
380,"Sentosa Island is a vibrant and action-packed destination with something for everyone. From thrilling attractions like Universal Studios Singapore, Skyline Luge, and the new LEGO World and Harry Potter: Visions of Magic to relaxing beaches and scenic walking trails, it’s truly a must-visit. The best way to reach Sentosa is by the cable car from Mount Faber, which offers beautiful views and comes in different fun themes. There’s also a bridge connecting the mainland, but the cable car adds an extra bit of charm to the experience. The island is quite large, and trying to cover all the attractions in one day isn’t really practical—Universal Studios alone takes an entire day to fully enjoy. For beach lovers and foodies, there are plenty of beaches and restaurants offering a wide range of cuisines, making it a great spot for a gastronomic adventure. We tried the Skyline Luge, which was exciting and a little thrilling, though we had to wait quite a while as it was a weekend and the place was crowded. I recommend arriving early and using the tram service to get around the island easily. All in all, Sentosa is a perfect blend of fun, nature, and leisure.",5,79,3
381,"A truly magnificent and serene experience.  The Buddha Tooth Relic Temple is an absolute must-visit in Singapore. The architecture is breathtaking, inspired by the Tang Dynasty, with stunning details and vibrant colors that make it a standout in Chinatown. It's not just a temple; it's a beautifully maintained museum and a place for quiet reflection.  Walking through the different floors, you can feel the sense of peace and history. The main hall with the huge Buddha statue is awe-inspiring, and the rooftop garden is a hidden gem—a tranquil escape from the city bustle, complete with a beautiful prayer wheel.  I highly recommend taking some time to explore all the levels and soak in the peaceful atmosphere. It's a wonderful cultural and spiritual experience that everyone, regardless of their background, can appreciate.",5,81,1
382,"This temple is absolutely stunning. From the detailed architecture on the outside to the rich golden interior, it is filled with peaceful energy. Every floor is worth exploring, especially the main hall, which leaves a strong impression.  There was no wait to enter, and the entire experience felt calm and respectful. The atmosphere is perfect for reflection and quiet appreciation.  I highly recommend visiting this temple when in Singapore. Even if you’re not Buddhist, the beauty and serenity of this place are truly remarkable.",5,81,2
383,"​I had a truly unforgettable experience visiting the Buddha Tooth Relic Temple. It's a stunning and beautiful temple, and I feel so grateful to have had the opportunity to be there. I was particularly impressed by the incredible collection of ancient Buddha statues, Chinese angels, and other historical artifacts. There is so much to see and explore, and every corner tells a story. It was a very memorable and moving visit.",5,81,3
