id,comment,rating,placeId,touristId
231,"Free admission for local.  When I visited, only two galleries were open while the others were closed. Still, I really enjoyed the experience—many of the artworks were creative and thought-provoking. Singapore could definitely use more art spaces like this to inspire and support local creativity.",4,50,1
232,"Visited on a Wednesday morning and it was a relaxing trip with interesting artworks and interactive areas (newspaper cutting for wall mural, stickers and letter writing for children) in the 3 exhibitions. Cozy cafe outside the exhibition hall. Free admission for locals. Took the lift up to level 3 at lobby B for 1 of the exhibitions.",5,50,2
233,"Wow, what a wonderful gallery. When we visited there was a combination of art from the permanent collection as well as some amazing temporary shows. Staff welcoming and helpful. Food vending machines available. A must visit for anyone who is interested in contemporary art. We caught the bus which was very convenient - if coming from Civic keep walking once you get off the bus, and then go through the pedestrian gate - once through the gate the sign posting improves.",5,50,3
234,"Interesting place! Of my xxth years in SG, I did not realise that there is a museum at such an unassuming place. It has interesting pieces being displayed - worth visiting. I was interested in the collection of books they had at the lobby. Unfortunately, it's not for sale, but you can always pick it up and read on premises. Will be back as I did not get the full experiences as we went there during PH, whereas some places are closed. in addition, some sections of the museum were closed for refreshing their collections.",5,50,4
235,It’s new and still not that well known so we were the only one there. Most of the exhibitions are still a work in progress so I recommend going there a bit later in the year to make sure you experience your money worth.,3,50,5
236,Love the design center. Always an experience. They have the Desa Potato exhibition but on the last week already. A cool showcase of how to reduce waste and uplift.,5,51,6
237,"Visited National Design Centre and had a great experience! I happened to come during the UNIQLO Spring/Summer 2025 pop-up booth, which was a fantastic showcase of their latest collection. The space was well-organized, and the setup blended seamlessly with the centre’s creative and modern atmosphere.  A special highlight was visiting on Valentine’s Day, where I received a flower while wearing a UNIQLO product—such a nice surprise that added a thoughtful touch to the event! The overall vibe of the space is inspiring, making it a great place to explore design, fashion, and creativity.  Definitely a must-visit for those who appreciate art, design, and unique pop-up events in Singapore! Looking forward to returning for more exhibitions and special showcases in the future.",5,51,1
238,Nothing is possible exhibition. I will like to extend my greatest appreciation to the artist and workers. What a huge project it is. Hope the message is clearly disseminate to those who attend the exhibition.,5,51,2
239,Very interesting installation at the National Design Centre! The creative works on display are truly impressive.,5,51,3
240,"Classic art deco building with a simple large space interior that has various rotating shows, so it's worth checking back to see what's on. Also wonderful Tanuki Raw Cafe, bookshop, and unique goods clothing and accessory store.",5,51,4
241,"Arrive early to explore the surrounding Victoria Theatre and Empress Lawn, or take a walk by the Singapore River. Nearby cafes and restaurants also make it easy to enjoy a full night out. Overall Rating: ★★★★★ (5/5) A truly enriching venue that combines cultural heritage with exceptional musical experiences. Whether you’re attending your first concert or you’re a seasoned music lover, Victoria Concert Hall offers a memorable night out in Singapore.",5,52,1
242,"Against all odds, I was impressed  Look, I’m not exactly the “classical music” type. I used to think it was all a bit stuffy—people in black, playing long sad notes, lots of bowing. I’ve always been more of a casual listener (if that), and I definitely didn’t grow up going to concert halls. But something shifted.  I watched my first full choral concert here a while back—a performance by the Voices of Singapore Ladies’ Choir. I didn’t expect much. I thought I’d be bored. Instead, I sat there, completely taken in. The harmonies, the precision, the way the sound filled the room—it got to me. I didn’t know music could feel that human and that powerful.  More recently, I actually performed here with the Singapore Symphony Chorus for Choral Encounters. Standing on that stage felt surreal. The acoustics are no joke—everything you sing comes back to you clean and balanced. It’s not flashy or high-tech, but it works. You don’t have to push; the hall does a lot of the work.  The venue itself is old-school, but in a good way. Built in 1905, restored nicely. Not huge, not small—just right. It’s right in the city centre, next to the river and some museums. Easy to get to. Comfortable seating, good visibility, nothing to complain about.  I came in a skeptic and left feeling… moved? Changed, even. Classical music isn’t just for other people. This place helped me realise that.  So yeah—five stars. Didn’t expect to say that, but here we are.",5,52,2
243,"We’ve been coming here several times over the years. Beautiful concert hall with colonial-era architecture. It’s an old historical building but very well-maintained. Comfortable seatings and good air-conditioning. Friendly and helpful staff. Dress standard is pretty relaxed. I’ve seen people in tuxedos as well as in t-shirts & shorts. Within walking distance from City Hall and Raffles Place MRT stations but not sheltered all the way so an umbrella is needed when raining. No F&B outlets on premises for commoners like us, only one super fancy restaurant. But Funan is about 10-minute walk away.",5,52,3
244,"🟨 Victoria CONCERT HALL ➡️ 11 Empress Place, #01-02, Singapore 179558  🟧 Victoria Concert Hall was originally built in 1905 as the Victoria Memorial Hall and it formed one half of the twin complex.  🟧 It was renamed ""Victoria Concert Hall"" in 1979 when it became the Singapore Symphony Orchestra’s ( SSO) home, replacing the original Town Hall auditorium.  🟧 It underwent a SGD158 million restoration from 2010 to 2014, carefully conserving the neo-classical façade, re-instating original courtyard passageways, and other heritage elements.  --------------------------------  🟣 Acoustics & Hall Layout ***************************** 🟣 The main concert hall seats a total of 673 patrons:  🟣 538 in the sloping stalls seats and 135 in a compact Upper Level Circle balcony.  🟣 The vast concert stage area serves as a platform for both orchestra, piano and organ performances.  🟣 Victoria Concert Hall also boasts Singapore’s only fully mechanical 2,012-pipe Klais organ ( ➡️ installed in 1987),  which adds majestic resonance to performances. ___________________________________  🟦 Interior & Ambience *************************** 🟦 The post-renovation atrium ➡️ a glass-roofed, light-filled space connecting both Victoria theatre and hall—creates a bright, welcoming mid‑performance interlude.  🟦 Interior pillars and ornate moldings were restored by craftsmen from South India, revealing the original grandeur.  🟦 Lighting and material choices blend classical and modern: ➡️ gold-toned stainless fixtures, and warm-cream-shade upholstery evoke a luxurious and refined feel. ____________________________________  🟢Visitor Experience *********************** 🟢  There are 3 main audience levels: ground-level sloping stalls, first-floor Circle, and the elegant foyer / atrium area enhancing both visual and social appeal.  🟢  The hall feels intimate and acoustically precise ➡️ a great match for chamber music, orchestral recitals, and organ performances.  🟢  To me, Victorial Concert Hall is a heritage space where heritage meets contemporary event comfort.  💛 This was where my late foster Baba Peranakan father would bring me to watch concert performances at times when I was a small child.  💜 So the memories I have of this place are deeply embedded in the labyrinths of my mind.",5,52,4
245,"Victoria Theatre and Concert Hall is a beautiful collage of heritage and modernity. From the outside it looks like a gorgeous neoclassical architecture but inside is pretty much a modern building.  Around the Hall are parks and museums and if you’re tourist like me, strolling around the grounds and taking photos is a must! In the background are some of Singapore’s iconic buildings.  If you’re walking during a sunny day though, be sure to put on sunscreen, and a hat for extra sun protection - especially during summer.",5,52,5
246,"I recently visited the NUS Museum and was absolutely fascinated by its collection focused on animals and natural history. One of the highlights was seeing the impressive dinosaur bones and massive whale skeleton, which offered a real sense of scale and history that photos simply can’t capture.  The museum features countless specimens that showcase the incredible diversity of the animal kingdom. From preserved insects and reptiles to birds and marine creatures, each display taught me something new about how different species evolved and adapted to their environments. It was amazing to learn how animals are all interconnected and how their evolutionary paths reflect broader changes in the world around them.  The exhibits do a fantastic job explaining complex topics like natural selection, extinction, and ecological balance in an engaging and easy-to-understand way. I left with a deeper appreciation of the delicate harmony in nature and how humans fit into the story of evolution.  I highly recommend booking tickets in advance to have enough time to explore every section without rushing. Overall, it was an eye-opening and enriching visit — perfect for anyone curious about how life on Earth has developed and continues to change over millions of years.",5,53,2
247,"It's free and it's just opposite of Natural history museum. We can be sure to find Ancient Chinese pots, earthenware, ceramics. There are few artifacts from India and one from combodia. There are some paintings and art installation. A few crazy things were there in sculptures and art. Otherwise simple, neat museum which you can cover in a couple of hours",4,53,3
248,"Nice place, very kind staff, free ticket. Thank you for the hospitality",5,53,4
249,"Entry to the museum is free but depending on the crowd outside you could be waiting up to 30 minutes to get in. Upon entering, the staff will give you a briefing on what you can and cannot do inside of the building. There are three levels. The first and third floors being dedicated to pottery of different time periods. The second floor is more for temporary exhibits and more exploratory things. The exhibits on this floor could use more explanation instead of a number next to such exhibits, as I had a hard time understanding why it was even displayed in the beginning. Overall a good place to visit if you happen to be within a stones throw from here.",4,53,5
250,"NUS Museum is a university museum focused on Asian art and culture, with a mix of historical and contemporary works. The space is nothing grand but large enough to house a good range of exhibits, and very comfortable — calm, quiet, and peaceful when I visited, perfect for a slow, reflective visit.  The permanent collection is well-curated, and they currently have two excellent exhibitions: Fistful of Colours: Moments of Chinese Cosmopolitanism and Unfettered Brush: The Art and Writings of Tan Joo Jong — both worth checking out.  Overall, a hidden gem if you enjoy art and want a quiet museum experience.",4,53,6
251,"Sun Yat Sen Nanyang Memorial Hall is a historical site dedicated to the life and legacy of Dr. Sun Yat-sen. The museum showcases his contributions to the revolution, with exhibits highlighting Singapore's role in modern Chinese history.",5,54,3
252,"💙 I have been here twice to this Sun Yat Sun Memorial Hall. ● Once, in the mid 1970s, when I was a small child, my biological mum took me here.  ➡️ Back then, the Memorial Hall was very dilapidated.  ✅️ Now, it is beautifully restored.  🩷 As I live nearby in Toa Payoh East, we would sometimes go to Balestier Road, and would pass by Ah Hood Road, and pass by this Sun Yat Sen house.  🥰 I am super faniliar with this area, because as a child born in mid-1960s, my foster Baba Peranakan family lived at Jalan Ampas ( ➡️ off Balestier Road) and I grew up here before we all moved to Toa Payoh East, just across the large canal.  🧡 The museum memorial hall is nicely done up. ● It has tons of memorial artefacts & many of the vintage pics reminds me of my 1960s childhood era.  I still pass by this 孙中山 hall from time to time.  🟪  This mansion memorial hall is truly worth a visit. ✨️🎉Please come and learn about the history here. It is a deeply educational and informative experience.",5,54,4
253,"Well maintained with many different activities and events happening through the year. The gallery and exhibits depicts the deep history of many significant personas along Dr Sun. Great place for chinese cultural roots immersion and festivals, esp. for kids who always get to participate various workshops and fun learning.",4,54,5
254,"Interesting and quite informative!  Free for Singaporeans and PR 8 $ for expats ( EP, DP) and 5$ for students studying in Singapore  Guided english tour available at 2pm  The staff are cordial and have a pleasant personality.  Well maintained premises including the garden.  Worth it! We spent a good 2.5 hours exploring the 2 floors on a Thursday afternoon.",5,54,6
255,"The Sun Yat Sen Memorial Hall poignantly celebrates the legacy of Sun Yat Sen, the Founding Father of the Republic of China. This museum not only honors his brief stay in Singapore and his efforts to rally support against the Qing Dynasty but also showcases the generous contributions of local Chinese merchants to his cause. A revealing glimpse into a time when the Chinese diaspora in British-ruled Singapore played a pivotal role in China's fight for independence.  Audio guide: check the schedule. They had a specific time slot only.",5,54,1
256,"I visited the Asian Civilisations Museum on a Sunday at 10:15 AM and was pleasantly surprised to find no queue. We waited around 40 minutes for the guided tour at 11:00 AM, which I highly recommend. The one-hour tour provides deeper insight into key artifacts and also highlights lesser-known pieces with fascinating stories that are easy to overlook.  The museum spans three levels, and you could easily spend an entire day exploring its exhibitions. If you don’t plan to dine at the museum restaurant, consider bringing some snacks or takeaways. The displays cover a wide range of Asian civilizations. They offer a rich perspective on Asian history through trade, art, and cultural exchanges.  Amenities include free lockers, charging ports with locks, and water dispensers. There is also a children’s section, but note that all visitors are required to wear socks, so plan accordingly if you're bringing kids.  One area that could be improved is the navigation within the museum. I found it a bit confusing to figure out where each exhibition starts and how to move through the different exhibitions.  Overall, I highly recommend a visit to the Asian Civilisations Museum for anyone interested in learning more about Asia’s rich and diverse heritage.",5,55,2
257,"Impromptu decision to go ACM!  The Asian Civilisations Museum in Singapore offers a rich and thoughtfully curated exploration of Asia’s diverse cultural heritage. From ancient artifacts to beautifully presented exhibitions on trade, faith, and craftsmanship, there’s a depth and clarity to the storytelling that makes each gallery engaging.  The space itself is well-maintained, peaceful, and perfect for a slow, reflective visit. I'm glad I spent my Saturday afternoon there, and did an hour of free tour with the volunteer guide.  Whether you’re a history enthusiast or a casual visitor (like me), it’s definitely worth spending a few hours here. Highly recommended for both locals and tourists alike.",5,55,3
258,"The museum is very beautiful and interesting. They have volunteers that do guided tours and they are for free (included in the ticket). The point is, if you want you can spend the day there and attend all guided tours available. We only had one, and it started from the top floor. She told us about ceramics, ways of crafting them and how they changed over time. The vessels and the meaning of the paintings done on them. Then we continued to fabrics and jewelry - the guide was very passionate and told us the stories in a very pleasant manner.",5,55,4
259,Smartly curated museum with a overall presentation of Southeast Asian art. The gallery on beliefs includes several exhibitions of religious artifacts. There are two restaurants for a quick bite. Perfect place to visit during the hottest hours.,5,55,5
260,"It is always great to seek to understand one's roots, beliefs and practices. To find your place in the world and how people in different countries are unique and yet the same in many ways. How each have interacted in the past and how choices or pacts made then affect the way we live our lives now.  The Asian Civilisations Museum provides a venue for understanding and realization. It is not just a textbook you read in elementary or high school but actual artifacts provide the backdrop for greater appreciation of history.",5,55,6
261,"Where the Nation’s Story Comes Alive  A truly enriching experience that offers a deep understanding of Singapore’s history and evolution. I had the privilege of joining a guided tour, and the guide was fantastic — simplifying complex stories and engaging the audience with real enthusiasm and clarity.  The main gallery took me about an hour to explore, and it was time well spent. The exhibits are well-curated, informative, and presented in a way that’s both accessible and immersive.  There are also other galleries and museums nearby, so it’s a great cultural hub to explore further.  Highly recommended for any visitor who wants to understand where Singapore’s journey began — it gives powerful context to the city you see today.",5,56,1
262,"You can't go wrong with National Museum of Singapore, highly curated to share the history of the island state with great information.  If you are a history buff or just a visitor.  I am sure you will learn a thing or two after your trip here.  Tips: always look out for their special exhibition that they usually put on once in a while during special occasion. This time it's LEGO.  Hope you enjoy your trip here.",5,56,2
263,"No regrets spending about three hours at the National Museum. We started with the LEGO exhibit and were truly impressed by the intricately crafted models built around the SG60 theme, which celebrates Singapore’s 60 years of nationhood. The exhibit beautifully captured iconic landmarks, historical moments, and everyday scenes that reflect how far the country has come since its early days. It was a refreshing way to revisit our history lessons from school and appreciate the transformation of Singapore into a thriving global city.  The entire experience was enriching and thoughtfully curated to connect visitors to the nation’s past and present. The museum also made the visit interactive and engaging by incorporating games — visitors could complete challenges and record their answers using a wrist tag, an innovative idea that kept everyone motivated to explore more. It’s an experience I highly recommend.  Redeeming tickets was generally user-friendly, but there was no clear instruction that you need to reach inside the collection box to retrieve your printed tickets. We waited for a while, thinking they would automatically appear in front of us, until a helpful volunteer came to our aid before we held up the queue.  Other than that small hiccup, everything was satisfying. This worthwhile exhibition proves that seeing truly is believing — a must-visit for anyone who wants to experience Singapore’s story in a unique and memorable way.",5,56,3
264,A beautiful heritage building set the tone of the visit. A wonderful mixture of history meets  modern day vision. Interactive and visual displays .  Ot knowing to much about the history of Singapore other than some war facts I found it very informative. Would highly recommend and then going to fort canning right next door,5,56,4
265,"Amazing museum, so we'll paced, lots of information, I learned so much about Singapore having known almost nothing beforehand. A little expensive as a foreign tourist (25$, approximately €16) but honestly worth it if you enjoy learning history and culture. The park outside is also stunning with even more historical marks that mean even more once you get some historical context from the museum. Very friendly and helpful staff as well.",5,56,5
266,"A historical, wonderful, quiet, final resting place cemetery and park. One not only can enjoy the beautiful and well maintained plants and gardens with the quiet environment, can also learn about the history behind the park and those who rest in peace.",5,57,5
267,"Visited the Japanese Cemetery Park and was struck by how peaceful and beautiful it was. The pink flowering archways and quiet paths make it feel like a hidden sanctuary. It’s a respectful, serene place to reflect and appreciate a piece of history. Definitely worth a visit for a calm walk and quiet moment.",4,57,6
268,"A hidden gem in Singapore, this park is incredibly serene and well-maintained. Rows of neatly arranged tombstones create a quiet, respectful atmosphere that’s perfect for a light hike.  Visited on a cloudy day, the place remained clean and peaceful, with hardly any visitors around.  Pop in your earbuds and take in the tranquility. It's a calming escape from the city’s usual pace.",5,57,1
269,"Calm and relaxing space. Although it is quite far away from the city center, I still am happy to have visited there. Unfortunately the praying room was closed though.",4,57,2
270,"Quiet & serene place. not alot of visitors when i came, Place is open from 7am & closes at 7pm. It is still a cemetary so please be mindful if you decide to come.",5,57,3
271,"Located near the Anderson Bridge and Victoria Concert Hall, this monument is easily find.   Erected in 1850, this Dalhousie Obelisk is a significant historical monument is Singapore's first public monument, commemorating Lord Dalhousie's visit and symbolizing free trade. Its intricate carvings and neoclassical design, rendered in granite, showcase the artistry of its era. Given its proximity to other major cultural sites like the Asian Civilisations Museum and the Victoria Concert Hall, it's an ideal and convenient stop for a full day of cultural exploration.",4,58,4
272,"Tucked away in a quieter corner of Singapore’s historical district, the Dalhousie Obelisk stands as a subtle yet evocative reminder of the city’s colonial past. While not as prominently showcased as some of Singapore’s larger landmarks, this modest monument offers a unique glimpse into history for those willing to seek it out.  Historical Significance and Atmosphere The Dalhousie Obelisk, with its clean, slender lines and understated elegance, carries the air of a bygone era. Erected as a marker of colonial heritage, it invites visitors to pause and reflect on the early days of Singapore’s transformation from a trading post to a modern metropolis. The monument’s inscriptions and design speak quietly of the figures and events that shaped its historical context, making it a fascinating subject for history enthusiasts.",5,58,5
273,You cannot miss it. Great place to chill out. Put it on your trip - you can take a rest in available chair in around. Take a pictures with a glass ball- such a great reflection photo.,5,58,6
274,"Saw this in March before the Singapore Shutdown. This monument was raised to mark the visit of James Andrew Broun-Ramsay. A colonial administrator in British India who rose to become Governor-General of India. This obelisk was raised by the Chinese and Malay citizens of Singapore to mark his visit in 1850, so it's called the Dalhousie Obelisk as he was also the 1st Marquess Dalhousie. Not a must see, but it’s a of a landmark in Boat Quay.",3,58,1
275,Nice obelisk with a sign telling of its origin,5,58,2
276,A statue of Sir Stamford Raffles. There is a plaque stating abt his arrival and much more. A nice place to visit overall if u r history fan who just wants a quick journey to see all the historical sights at the Singapore river.,5,59,1
277,I visited the Statue of Sir Stamford Raffles in Singapore. It’s an iconic landmark with a classic design that honors the city’s founder—great for a quick history stop and photos.,5,59,2
278,"That's the Raffles landing site he first landed and signed the treaty with Johor Sultan that founded Singapore for British. I feel the statue is too whitish! 😂😁 Should have multi colors with our modern times' trend. Singapore is conservative, and should have perhaps used the Raffles landing site as an arts street for artist competitions or for free flea market selling art work. It shouldn't be that empty all day everyday 😂😜 I'm offering FREE tour guiding to anyone touring Singapore as a practice for my upcoming final assessment as tour guide. Please call me NOW!!",3,59,3
